,NEG,NEU,POS,label,cars
224,0.02476932853460312,0.9565927982330322,0.0186378862708807,NEU,succinct and true
225,0.026463162153959274,0.7797712087631226,0.19376562535762787,NEU,these stats are from 
226,0.11575344949960709,0.255127489566803,0.6291190385818481,POS,thank you for actual stats
227,0.7532495856285095,0.23797424137592316,0.008776180446147919,NEG,ok this is pretty epic i love when leaders ignore big problems to increase tax revenues in areas not really seen as a problem go politics
228,0.9711625576019287,0.02644769474864006,0.0023897839710116386,NEG,ya but thats not really the point why isnt the gov focusing on things that actually make it safer intead of things that make them more money   i used waze i just drove across  states and didnt hear one traffic cam ahead until i hit the dmv  then it happened every  minutes it was like a joke from a sitcom
229,0.7678221464157104,0.22631844878196716,0.00585941830649972,NEG,people probably dislike your shitty post because dcs streets are dangerous and all you have to do to avoid a speeding ticket if to drive at the posted speed limit
230,0.8490226864814758,0.14725099503993988,0.0037262721452862024,NEG,have an upvote i agree that more cameras are just another way to tax residents and not tackle larger issues
231,0.1272876113653183,0.8626117706298828,0.010100631974637508,NEU,thats because this subreddit is anti car regardless of the argument
232,0.06089667230844498,0.8522815108299255,0.08682184666395187,NEU,i heard mass ave is just  to  years from being fimished
233,0.0038868370465934277,0.20497605204582214,0.7911370992660522,POS,same
234,0.2941800057888031,0.6771124005317688,0.02870759554207325,NEU,i agree
235,0.07727348804473877,0.9055788516998291,0.01714763045310974,NEU,probably more effective to put speed bumps everywhere  out cut outs in the bumps for buses people might get so sick of the bumps they start to take the bus and metro instead
236,0.015006580390036106,0.47899511456489563,0.5059982538223267,POS,the average driver spends  hours a year in traffic in dc its  hours a yearhttpswwwgilmanbedigiancomcarcrashfactsstatisticsindc
237,0.07161670923233032,0.8567065000534058,0.07167673856019974,NEU,hahahaha
238,0.5120804309844971,0.47803646326065063,0.009883121587336063,NEG,huh
239,0.139677956700325,0.7796993255615234,0.08062274008989334,NEU,i always pay them even though i live in md i know that one day it will come back to haunt me if i dont take care of it
240,0.9262058138847351,0.07132158428430557,0.0024725438561290503,NEG,depends on what you mean by effective  does effective mean making the roads safer or does effective mean making more money for the gov
241,0.14661942422389984,0.7987157702445984,0.05466480180621147,NEU,there are no repercussions for not paying traffic camera tickets again the average law abiding citizen is negatively affected by current city council policies
242,0.44686785340309143,0.5354053974151611,0.017726706340909004,NEU,yeah  in dcs case its definitely revenue generating which is a shame because theres good data showing that if implemented correctly passive enforcement can reduce accidents and unsafe driving however this requires judicious placement of cameras and an actual enforcement mechanism for repeat offendersdc places their cameras where theyre likely to catch people speeding not necessarily in spots where enforcement is really needed  for example near my house theres a camera at the bottom of a hill on a four lane thoroughfare that is technically residential because there are some houses on it the design of the street encourages people to drive above the posted speed limit and the placement of the camera at the bottom of a steep slope makes it all the more likely that people will be going above speed when they pass the camera   theres another camera on an access road on  that for some inexplicable reason is mph but the speed markings are extremely unclear again the design of the road encourages speeding and its not really in an area where enforcement is badly needed  both of these cameras feel like traps im sure they generate tons of revenue for the city but theyre not near pedestrian heavy areas of schools or the likecouple this with the lack of enforcement  no reciprocity with md or va no requirement to pay violations to renew your license not collections for over due tickets barely any booting or towing  and theres virtually no incentive to pay attention to cameras sure  maaaaybe youll get towed but its pretty unlikely people regularly wrack up k worth of tickets and face no consequences like i said it feels like the city is playing a numbers game blast out tons of tickets and if even a small percentage pay up its big money but the people that pay arent the regular repeat offenders
243,0.5835378170013428,0.4090201258659363,0.007442072033882141,NEG,not op but yes that was always the plan with speed cameras if the city really cared they would make changes to roadways like narrowing them creating bump outs more speed humps creating pedonly streets etc speed cameras are purely a band aid and the preferred band aid at that because the city can line its pockets whilst signing off on multi million dollar contracts with the camera installation and maintenance companies
244,0.1259436011314392,0.8647919297218323,0.009264538064599037,NEU,minor infractions are their words because you dont get a ticket unless youre going mph over the speed limit
245,0.7546186447143555,0.2330315262079239,0.012349800206720829,NEG,there are  outstanding tickets from md and va there are  bootable vehicles from those two states and dc has  boot crews who have been getting about  a day but some of them are dc residents too the number of people they are getting is a rounding error
246,0.9730281233787537,0.024158921092748642,0.0028130202554166317,NEG,i know right plus youre naturally going faster because of that little decline in the road just a absolute joke
247,0.03367443010210991,0.9443529844284058,0.021972646936774254,NEU,how are people this stupid theres pedestrians on either end of the tunnel the excuses you people make to speed with impunity are incredible
248,0.6236878037452698,0.3705882728099823,0.005723900161683559,NEG,they get the money to install them
249,0.35058048367500305,0.6361295580863953,0.013289953581988811,NEU,according to this md and va drivershttpswwwwusacomarticlenewsverifysomestatesdonotpunishtheirdriversforoutofstateinfractionsffccbfccedfbdf are practically exempt from camerabased tickets im guessing op means that this lack of enforcement makes them more likely to ignore red lights and speed limits	by now you probably heard about the loophole where drivers from maryland and virginia dont have to pay penalties from speed and redlight cameras in dc it is because the three areas havent come to a reciprocity deal
250,0.026330582797527313,0.6099214553833008,0.3637479245662689,NEU,ujamesda beat me to it i also think they should have a bounty system where the booting team can crowd source leads on the locations of cars with the highest amount of unpaid tickets so they can prioritize the most flagrant offenders
251,0.20702554285526276,0.6487087607383728,0.14426566660404205,NEU,i see cars driving slower around speeding cameras at slower speeds collisions become less deadly seems pretty conclusive to me
252,0.6876707673072815,0.30781593918800354,0.004513292573392391,NEG,no its a money grab thats what mrs bowser is good at her personal wealth went from m to m in her first term guess her reelection made her wonder how she could do that for the district which i guess is a step in the right direction but also bandaids for all
253,0.7323415279388428,0.2610757350921631,0.006582772359251976,NEG,one argument for cameras is that they penalize speeding without police interactions
254,0.967708945274353,0.029663827270269394,0.002627209760248661,NEG,can we consider connecticut avenue i live on connecticut avenue very close to where some fellow who shouldnt have been driving lost control of his suv and killed two women trying to have lunch on an unseasonably warm winter day but connecticut avenue a six lane road which primarily passes apartments condominiums and small commercial strips which is often clogged with personal commercial traffic including many delivery vehicles small and giant and transit buses which features signaled and nonsignaled intersections and crosswalks every few hundred feet and goodness i even forgot the bicyclists and all the construction projects i dont know thirty miles per hour seems reasonable would you be happier if the camera didnt kick in until you were doing   like where do you draw the line at what a reasonable speed would be what if the reasonable speed is  miles an hour but what happens to a speeding car on connecticut ave if hypothetically the driver loses control at  mph and goes flying into a restaurant or a ground level apartment or condo and what would have happened if that same driver was only doing  mph or  doing some math  assuming you drove this commute five times a week for  weeks out of the year took out  for vacation holidays etc rounded up that means your ticket avoidance rate is  sounds pretty good
255,0.08230916410684586,0.9052097797393799,0.01248099748045206,NEU,do you ever walk with children bike or do stuff outside of a car in dcspeeding is a terror it killsmaims people and its got to stop
256,0.011998373083770275,0.8737547993659973,0.11424678564071655,NEU,theres already cameras on most street corners in this city
257,0.9314588904380798,0.06575001031160355,0.0027910619974136353,NEG,want some cheese with all the whine
258,0.6668070554733276,0.32585909962654114,0.00733390124514699,NEG,we live in a city  there is never no one on the streets  the fine is supposed to be punitive its literally a punishment
259,0.8289966583251953,0.16383476555347443,0.0071685644797980785,NEG,are you proposing we increase speed limits at night despite there being significantly lower visibility and more intoxicated drivers
260,0.8417940139770508,0.15384377539157867,0.004362249281257391,NEG,i dont speed either im a very careful driverokbut still get  tickets a year for  eachhmmm yesand almost every time its mph in a sir that is speeding
261,0.6810427904129028,0.30792734026908875,0.011029846034944057,NEG,all these downvotes are we the only people that dont like the cameras and think money could be allocated to things that actually make a difference
262,0.002019347622990608,0.068300761282444,0.9296799302101135,POS,please dont feel insecure about your opinion and think you need to hurl insults to get it across let it stand on its own youve got some great points  i think youre ignoring the point of the post though  its not about getting out of speeding tickets its about how dc has the most speeding cameras and the most fines of any city by your own admission the streets are still dangerous so why are we tripling the number of cameras  if like you say the streets arent any safer then why are our elected officials focusing on something that doesnt make the streets safer
263,0.044167160987854004,0.7434240579605103,0.21240876615047455,NEU,awe thanks  back to  on the post
264,0.07216360419988632,0.8650956749916077,0.06274064630270004,NEU,your link also says dc has much fewer traffic deaths than our neighbors
265,0.18631301820278168,0.806430995464325,0.007255992852151394,NEU,whut
266,0.9699601531028748,0.02764492854475975,0.002394887851551175,NEG,so if a dc resident ignores tickets from cameras there are zero repercussions  im just making sure i understand this correctly
267,0.9175528883934021,0.07972463220357895,0.0027224409859627485,NEG,thats the part i dont like people with k much less k in speeding tickets have no business driving they need to get tougher on the recklessness and not just let up all the time when people are irresponsible
268,0.9370861649513245,0.06064840778708458,0.0022654884960502386,NEG,likely to catch people speeding literally means likely to catch people breaking the law
269,0.10824336856603622,0.8608059883117676,0.030950631946325302,NEU,the boots are use for parking violationsred light and speed camera violations have no teeth as there is no assessment of points on driving records the reason why is because camera violations are issued to vehicle registration tag and not to drivers license
270,0.3101358413696289,0.6435522437095642,0.04631201550364494,NEU,cars have brakes
271,0.9751569032669067,0.02232646569609642,0.002516590291634202,NEG,deleted
272,0.337245374917984,0.6491823792457581,0.013572219759225845,NEU,you have to drive dangerously slow to avoid this camera in addition to your comment being very dumb it also comes off rude as fuck
273,0.7641487121582031,0.23043282330036163,0.005418506450951099,NEG,oh ya i figured they were closing that loophole by adding a lot more dc enforcement ive been seeing all the posts where drivers are getting booted in dc
274,0.944293200969696,0.053386248648166656,0.0023204986937344074,NEG,but im talking about connecticut ave where the cameras are well north of friendship heights between the circle and east west highway theres literally zero foot traffic one school that has a crossing guard and a traffic light and lets be honest these are che y chase kids who do not walk to school there are few intersections is a straight line its empty yet has a speed camera  its a shameless money grab almost as bad as the military road camera by st johnsedit i guess my real gripe isnt the speed camera its the speed limit  is too slow for a road that was built for  but by using a camera you actually get enforcement of an arbitrary speed limit the road must be altered to match the speed limit before punishing people for traveling a safe speed that is higher than the posted number
275,0.962180495262146,0.03368080407381058,0.004138787742704153,NEG,until they address the bikeratv gangs that dont even stop for red lights i think they have bigger issues to deal with
276,0.22197623550891876,0.763058602809906,0.014965075999498367,NEU,ah ok thanks for letting me know its not worth conversing with you constructively
277,0.8443373441696167,0.13425923883914948,0.021403426304459572,NEG,its silly to say there is never no one on the streets do you sincerely believe theres people or cars out on every street at every hour this isnt nyc ive driven  miles in the last  months mostly in dc at all hours snd biked thousands of miles around the city at all hours i have a pretty good sense of the traffic patterns theres often totally empty streets in the middle of the night on weeknights especially in more residential areasand i get that its meant to be punitive but there could still be some scale like a warning for st offense  for lower speeds higher fines for running reds etcno one is at risk from me going  down th street at am on a tuesday
278,0.695371687412262,0.26838111877441406,0.036247190088033676,NEG,yes people love paying more money to their governments for less results its actually a crazy psychological phenomena
279,0.008523417636752129,0.2936123013496399,0.6978642344474792,POS,yeah i have great points because you dont have any dc doesnt have ticket reciprocity for automated enforcement so most of the tickets it issues are irrelevant again people like you are mad youre required to go the speed limit thats the only thing youre upset about
280,0.2612643241882324,0.7305276989936829,0.008207889273762703,NEU,yes correct
281,0.6116703152656555,0.38370198011398315,0.0046277581714093685,NEG,what does congress have to do with it
282,0.2746690511703491,0.7059264183044434,0.0194045789539814,NEU,under the law that was just passed i dont think it has been signed by the mayor yet you can still renew your license if you have unpaid tickets i think the only potential penalty is your car being booted
283,0.9503270387649536,0.04693631827831268,0.0027366923168301582,NEG,technically you could be booted and towed if you owe above a certain amount however the towing team is small and its pretty uncommon that people even people with k worth of tickets get towedbut the city wont send delinquents to collections theres no points system and you can renew your license even if youve got lots of unpaid tickets
284,0.9100809097290039,0.0869365781545639,0.0029824511148035526,NEG,id honestly be ok with the law if it were limited to nonmoving violations buuuut its not because its easier to pander to idiots that dont want to pay speeding tickets than it is to worry about people dying on the road way
285,0.28848567605018616,0.6941782832145691,0.017336037009954453,NEU,if all you care about is enforcement of the law then sure  creating silly speed traps that catch people that are technically in violation of the law is great id argue that a four lane mph residential thoroughfare is a fundamentally flawed concept that a speeding camera cant possibly fix id also argue than an service road with dog shit signage that forces people exiting the highway to slow from mph to mph in  feet is similarly flawed and wont be fixed by a traffic camera furthermore neither of these areas are particularly dangerous trafficwise so id question what problem the city is even trying to address by placing cameras therecouple this with the fact that there are areas that automated enforcement could actually make safer near parks schools pedestrianbike thoroughfares etc but they arent targeted by the city for enforcement because they probably wouldnt generate a huge number of tickets
286,0.08111882954835892,0.8602004647254944,0.058680783957242966,NEU,really i didnt
287,0.9690102934837341,0.028391776606440544,0.0025979585479944944,NEG,removed
288,0.9519886374473572,0.04488113895058632,0.003130111610516906,NEG,yeah imagine the audacity of the city to make drivers travel at  mph in a dense urban area just before encountering multiple crosswalks can you believe they dont just let selfish assholes like you bomb through the neighborhood with total disregard for pedestrian safety
289,0.3671460449695587,0.623929500579834,0.008924401365220547,NEU,wtf is dangerously slow when its the posted speed limit
290,0.9741278886795044,0.023678621277213097,0.0021934763062745333,NEG,maybe im confused isnt that maryland
291,0.892349123954773,0.10268997400999069,0.004960956517606974,NEG,that you are not capable of constructive conversation was communicated with your nonsense about in the name of public safety like they do in china same reason why people ranting about militant cyclists and wars on cars drivers or both arent worth my time
292,0.9500977993011475,0.04751769080758095,0.002384577179327607,NEG,i can see that youre one of those people who dont like to engage in conversation so ill oblige you
293,0.4773147404193878,0.5129321217536926,0.009753147140145302,NEU,there are cameras which have ridiculously low speeds which create extremely dangerous conditions you get half the drivers going  to avoid the ticket on a road where the appropriate speed is probably  and the other half going what should be the posted speed limit and it creates danger for all involved if it was about safety they wouldnt use cameras which create danger its about money so people are justifiably upset
294,0.008683968335390091,0.3061522841453552,0.6851637959480286,POS,diplomatic immunity and just forgiving politicians is a big reason they keep over taxing people who live and work in dc imo to recoup a ton of lost funds they will never get back from places like russiaalso when dc council and mayor decide the budget it has to then go to both potus and congress they can decide what they think is best these two things together i think make it where the city is always thinking of adding to the budget because it helps  they come down on the residents because so many others are skating costs but roads gotta be paved
295,0.9617525935173035,0.035392314195632935,0.0028551374562084675,NEG,gotcha  thanks
296,0.08111882954835892,0.8602004647254944,0.058680783957242966,NEU,weve all gotten confused in parking tickets but people drive like maniacs and then have the nerve to complain when insurance i our area is high
297,0.8713738322257996,0.12527582049369812,0.0033503042068332434,NEG,removed
298,0.004797164350748062,0.8229624032974243,0.1722404658794403,NEU,yeah this cam is on an expressway where no pedestrians are allowed if they want to put speeding cams near the pedestrian areas go for it but putting them on highways where the safe speed is above the posted speed limit they are knowingly creating dangerous conditions
299,0.0033951052464544773,0.9388560056686401,0.05774889141321182,NEU,great question this is what a large body of traffic science revolves around there is a very popular idea in traffic science called the th percentile rule to use someone elses words the institute of transportation engineers defines this as the speed at or below which  percent of vehicles travel in other words the speed limit on these roads would be set at a freeflowing traffic speed at which only around  percent of typical drivers would exceed and violate much of this theory is based on multiple studies which show that basically the majority of drivers will drive at a speed they feel most comfortablesafe at regardless of the posted speed limit  google scholar can be weird with links but there should be about  related studies if you swipe to the right httpsscholargooglecomscholarhlenassdtcqdriveatspeedsregardlessoflimitsbtngdgsqabstupdksffbemjhuej  so if the posted speed limit is way lower than what the average driver would feel is the ideal safe speeds conditions are created where there are large disparaties in speed and these disparities are what often lead to accidents and pedestrian deaths this is a very exaggerated example but imagine if we switched the speed limit on  to mph or a larger road like constitution ave nw to mph it may seem to some that this would make things safer in reality you would have most cars driving at the actual safest cruising speed and a few others going way slower essentially creating the formula for a crash so in short its more that the posted speed limit itself is dangerously slow here is a really good op ed which explains it better than i lolhttpsreasonorgcommentarydolowerspeedlimitsmakeroadwayssafer
300,0.976207435131073,0.02057175524532795,0.0032208363991230726,NEG,the  makes sense to me from chevy chase circle north until whenever the lanes widen which i think is eastwest or maybe a bit south of that i think they start widening out around the golf course and the road itself opens up to mph around the fire station or not far past it i think i thought you were talking about ct ave in dc proper
301,0.959111750125885,0.03834626078605652,0.0025419844314455986,NEG,if you wanna hurl insults then its obvious you dont want a constructive conversation dont be angry that i dont want to waste my time when im making genuine points and youre playing elementary school games i dont have time for you anymore not even in my leisure reddit time
302,0.08111882954835892,0.8602004647254944,0.058680783957242966,NEU,youre so wrong its actually laughable if the streets arent safe and we already have the most cameras then we need to have more because they obviously havent started working yet forget about those who dont pay or dont have tagsdrive illegal vehicles make the law abiders pay more epic
303,0.35489773750305176,0.6358903050422668,0.009211970493197441,NEU,removed
304,0.18881866335868835,0.6964238882064819,0.11475744843482971,NEU,the camera on k st is not a highway maybe you think it is but it isnt
305,0.8835777640342712,0.11169984936714172,0.004722354467958212,NEG,yeah ive read those none of them indicate driving the posted speed limit is dangerous unless youre saying  of people speed there in which just isnt true and is easily addressablealso great quoting a libertarian think tank op ed which quotes the automotive lobby
306,0.005332247819751501,0.9747604131698608,0.019907396286725998,NEU,okay dude just remember when you speed youre giving yourself traffic tickets cry about china all you want
307,0.8368148803710938,0.15887422859668732,0.0043108188547194,NEG,were talking about the one that is on the whitehurst freeway towards the k st exit right
308,0.5677409172058105,0.4165946841239929,0.01566438004374504,NEG,yeah no one is saying that driving the speed limit is inherently dangerous  were saying that having speed limits well below the design limits of a streetroad is inherently dangerous in a perfect world people would never exceed the limit even if its a dangerously slow limit but basing traffic policy on the logic that everyone will follow the rules and no one has ever and will ever exceed a speed limit is not just dumb but also encourages more pedestrian deaths and in my opinion more pedestrian deathsaccidents is bad so we should encourage policy which limits pedestrian deaths instead of increasing it it was determined that speed variance will approach minimum values if the posted speed limit is between  and  mph lower than the design speed outside this range speed variance increases with an increasing difference between the design speed and the posted speed limit it was also found that drivers tend to drive at increasing speeds as the roadway geometric characteristics improve regardless of the posted speed limit and that accident rates do not necessarily increase with an increase in average speed but do increase with an increase in speed variance
309,0.029015202075242996,0.950252890586853,0.020732032135128975,NEU,i think you just want the last word
310,0.18839789927005768,0.775513231754303,0.03608890250325203,NEU,yes its literally in front of a crosswalk
